id,name,background
mwd2d9d93a_3bd1_4f17_bac1_baba9ef2d55a,R_IL6_gp130,"The species named 'R_IL6_gp130', provided with the ID mwd2d9d93a_3bd1_4f17_bac1_baba9ef2d55a, seems to relate to components involved in the interleukin-6 (IL-6) signaling pathway, specifically centered around the gp130 protein. Although the context provided does not explicitly describe 'R_IL6_gp130', we can infer its characteristics based on similar biological components related to gp130 in IL-6 signaling.

### Biological Function and Role in Pathways
- **gp130 (Glycoprotein 130)**: Serves as a signal-transducing receptor component shared by many cytokine receptors. It plays a central role in the IL-6 family cytokine signaling mechanisms.
- **IL-6 Signaling**: The molecule gp130 is integral to both classical and trans-signaling pathways of IL-6. The classical pathway involves the membrane-bound IL-6 receptor (IL-6R) and is primarily active in immune cells. Trans-signaling occurs via a soluble form of the IL-6 receptor (sIL-6R) and is more widely active, affecting cells that do not have the IL-6 receptor.

### Interactions with Other Molecules
- **IL-6/JAK/STAT Pathway**: The gp130 acts as the signal transducer for IL-6-type cytokine receptors, leading to activation of the JAK/STAT signaling cascade, which is crucial for immune responses and inflammation.
- **Soluble gp130 (sgp130)**: This can act as a natural inhibitor for the IL-6/sIL-6R complex, limiting the effects of IL-6 trans-signaling.

### Importance in Biological Systems
- **Inflammation and Immune Response**: The IL-6/gp130 pathway is significant in the regulation of inflammatory responses, relevant in various diseases such as Crohn's disease, as mentioned in the context.
- **Therapeutic Implications**: Variants or derivatives like sgp130Fc, which can inhibit IL-6 trans-signaling, are under study as therapeutic options for inflammatory diseases.

In summary, while specific data about 'R_IL6_gp130' is not explicitly detailed in the context, by contextual association, it likely refers to a key player within the IL-6 signaling pathway, particularly involving gp130 in modulating immune and inflammatory processes through its interactions with IL-6 and its receptors."
mw4638f126_8cb8_4021_ab41_6ae195743ba0,sR_IL6,"The species referred to as 'sR_IL6' in the provided context is likely a soluble receptor related to the interleukin-6 (IL-6) signaling pathway. However, the context primarily references sIL-6R (soluble IL-6 receptor), which plays a prominent role in IL-6 signaling.

Here is a summary of the background information and inferred roles of 'sR_IL6', based on the context and general knowledge of similar molecules:

1. **Biological Function**: sIL-6R, which 'sR_IL6' appears to be closely related to, acts as a soluble form of the membrane-bound IL-6 receptor. It binds to IL-6 and can participate in inducing cellular responses, even in cells that do not express the membrane-bound receptor (classical signaling).

2. **Role in Pathways**: sIL-6R is involved in IL-6 trans-signaling. In this process, the IL-6:sIL-6R complex can interact with the signaling receptor gp130 on cell surfaces, initiating signal transduction inside these cells. This pathway is crucial for modulating inflammatory responses and is distinct from classical IL-6 signaling that involves membrane-bound IL-6R.

3. **Interactions with Other Molecules**: sIL-6R interacts with IL-6 to form the IL-6:sIL-6R complex. This complex can be sequestered by sgp130, another soluble receptor, which regulates its availability and, thus, the extent of trans-signaling.

4. **Importance in the Biological System**: In the context of the immune system, especially in diseases like Crohn's Disease, the IL-6:sIL-6R complex is critical due to its potent regulatory effects on inflammation. Targeting this complex can alter the disease course by modulating immune responses, highlighting its importance in therapeutic strategies.

Overall, sR_IL6 (assuming it is similar to sIL-6R) is a crucial component of the IL-6 signaling system, facilitating interactions that expand the range of cells responsive to IL-6, thereby playing a significant role in immune regulation and inflammation."
mw10315fa3_6f13_4618_bda8_a8694bd3c374,R,"Based on the provided context, the document discusses interleukin-6 receptor (IL-6R) and related biological components. Although the species 'R' with the ID 'mw10315fa3_6f13_4618_bda8_a8694bd3c374' is not explicitly mentioned, we can infer its context within the study.

The document describes the role of soluble interleukin-6 receptor (sIL-6R) and the targeting of IL-6Rα by antibodies, suggesting that 'R' could be connected to IL-6R, possibly a subtype or variant involved in the pathway under study. The general biological functions and roles related to IL-6R could include:

1. **Biological Function**: IL-6R is a part of the signaling pathway for interleukin-6 (IL-6), a cytokine involved in immune responses, inflammation, and hematopoiesis.

2. **Role in Pathways**: IL-6R is essential for the classical IL-6 signaling pathway, which involves the dimerization of IL-6/IL-6R complex with gp130, activating JAK/STAT signaling that leads to gene transcription.

3. **Interactions with Other Molecules**: IL-6R interacts with IL-6 to form a complex that associates with gp130. It can exist in a soluble form (sIL-6R), which allows IL-6 signaling in cells lacking the membrane-bound receptor, extending the cytokine's effects.

4. **Importance in Biological Systems**: IL-6R is crucial in moderating immune responses and inflammation. It is a therapeutic target in inflammatory diseases, as seen in treatments involving anti-IL-6R antibodies (e.g., tocilizumab) to reduce inflammatory markers like C-reactive protein (CRP).

Due to the lack of specific mention of 'R,' it might represent a molecule involved in the broader IL-6/IL-6R signaling pathway being studied, potentially playing a similar role in inflammation and immune regulation."
mw0adf3eb4_a196_4c48_b10d_4e9e9faaf9e1,IL6,"IL-6 (Interleukin-6) is a cytokine, a type of signaling molecule involved in immune regulation. It plays a significant role in the body's inflammatory response and is implicated in various diseases, including Crohn’s disease and rheumatoid arthritis. In Crohn's disease, IL-6 contributes to enhanced T-cell survival and resistance to apoptosis in the lamina propria, along with elevated chemokine secretion. This suggests a critical role in promoting inflammation and immune dysregulation associated with the disease.

IL-6 signaling can occur through two main pathways:

1. **Classical Signaling Pathway**: This occurs via the membrane-bound IL-6 receptor (IL-6Rα). In this pathway, IL-6 binds to IL-6Rα, and the complex recruits a membrane-bound co-receptor, gp130, forming a heterotrimer that subsequently dimerizes to create an active hexameric IL-6 receptor complex. This complex initiates the phosphorylation of gp130-bound Janus kinase (Jak) family proteins and leads to the phosphorylation of signal transducer and activator of transcription 3 (STAT3).

2. **Trans-Signaling Pathway**: This involves the soluble IL-6 receptor (sIL-6Rα) and allows IL-6 signaling to occur even in cells that do not express IL-6Rα. The IL-6/sIL-6Rα complex can bind to gp130 on various cell types, activating similar downstream signaling pathways as the classical pathway. Trans-signaling is thought to be particularly significant in disease contexts, like Crohn’s disease, where it can exacerbate inflammation.

IL-6 interacts with other molecules such as anti-IL-6 and anti-IL-6Rα antibodies. These interactions are crucial in therapeutic contexts, such as using tocilizumab, an anti-IL-6Rα antibody, in treating rheumatoid arthritis. Tocilizumab has been observed to have nonlinear clearance, consistent with its interaction dynamics with IL-6Rα, validating certain modeling approaches.

Overall, IL-6 is an essential player in immune responses and inflammation, making it a critical target in therapies designed to modulate immune responses in various inflammatory diseases."
mw7d86cc23_a1af_44c3_bdb9_71e9b1bb2a83,R_IL6,"The context provided from the document does not directly mention a species or molecule explicitly named 'R_IL6' with the specific ID provided. However, we can infer potential information about 'R_IL6' by examining similar components within the context of IL-6 signaling and receptor interactions as mentioned in the document.

### Biological Function:
- **R_IL6** is likely to be some variant or receptor related to interleukin-6 (IL-6). IL-6 is a cytokine involved in inflammatory and immune responses. Receptors related to IL-6, such as IL-6 receptors, mediate its signaling and subsequent biological effects.

### Role in Pathways:
- **IL-6 signaling** involves complex pathways where IL-6 binds to its receptor (IL-6R), which can exist in both membrane-bound and soluble forms. This interaction often leads to the activation of the JAK/STAT signaling pathway, resulting in the phosphorylation of STAT3 (pSTAT3) and the transcription of genes involved in inflammation, such as SOCS and CRP (C-reactive protein).

### Interactions with Other Molecules:
- **IL-6 interacts** with its receptor (IL-6R), either in a classical membrane-bound form or in a form that involves soluble IL-6 receptor (sIL-6R) and glycoprotein 130 (gp130), facilitating signal transduction. This signaling can be modulated by molecules like anti-IL-6 or anti-IL-6R antibodies, which are studied for their effects in treating conditions like rheumatoid arthritis.

### Importance in Biological Systems:
- **The IL-6/IL-6R system** plays a significant role in immune regulation. It is involved in acute phase reactions, hematopoiesis, immune responses, and inflammation. It is particularly important in disease contexts such as Crohn's Disease and rheumatoid arthritis, where dysregulation of its signaling pathway can lead to pathological outcomes.

Given these functions and interactions, it is reasonable to infer that 'R_IL6' is an essential component within the IL-6 signaling pathway, potentially representing a receptor or regulatory element of the pathway, playing a pivotal role in mediating immune responses and inflammation in the biological system being modeled."
mw0eb6c959_d408_45a0_a450_928b8c5876bb,Ractive,"The provided context does not specifically mention the species 'Ractive' (ID: mw0eb6c959_d408_45a0_a450_928b8c5876bb). Therefore, based on the general content of the documents, which discuss immune regulation, particularly involving IL-6 in conditions like Crohn’s Disease and rheumatoid arthritis, I can infer some potential roles for a species hypothetically named 'Ractive' within this context.

1. **Biological Function**: Given the context focuses on immune regulation mediated by the cytokine IL-6, 'Ractive' could be speculated to play a role as a regulatory molecule or modulator within immune signaling pathways, possibly interacting with cytokines or receptors involved in inflammatory responses.

2. **Role in Pathways**: It might be involved in pathways related to cytokine signaling, particularly influencing the IL-6 pathway or its interaction with the soluble IL-6 receptor (sIL-6Rα), given the emphasis in the document on these components and their therapeutic targeting.

3. **Interactions with Other Molecules**: 'Ractive' could potentially interact with IL-6, its receptor IL-6Rα, or the IL-6/sIL-6Rα complex, affecting their activity, stability, or clearance in the system, similar to how antibodies like tocilizumab are described to interact with these components in the context provided.

4. **Importance in the Biological System**: If 'Ractive' were involved in modulating IL-6 activity, it could be crucial in maintaining or restoring immune balance, particularly in pathological conditions like Crohn’s disease where IL-6 plays a significant role in the disease mechanism.

This speculative function aligns with the themes observed in the documents, which focus on the modulation of cytokine activity and therapeutic interventions in inflammatory diseases."
mw42054cd7_17af_46da_970c_7f99151906ad,STAT3,"STAT3, or Signal Transducer and Activator of Transcription 3, is a transcription factor that plays a crucial role in cellular signaling pathways. It is known for its involvement in mediating the effects of cytokines and growth factors, particularly the signaling of interleukin-6 (IL-6). Here's a summary of the relevant aspects of STAT3 based on the provided context and general knowledge:

1. **Biological Function**:
   - STAT3 is activated through phosphorylation, typically following the engagement of cytokine receptors such as those for IL-6. Once phosphorylated, pSTAT3 dimerizes and translocates into the nucleus, where it functions as a transcription factor to regulate gene expression.

2. **Role in Pathways**:
   - STAT3 is a core component of the JAK-STAT signaling pathway. In particular, it plays a significant role in the signaling events triggered by IL-6. This cytokine binds to its receptor, IL-6Rα, and utilizes the coreceptor gp130. The activation process results in the phosphorylation of STAT3, which then facilitates the transcription of target genes involved in various physiological processes.

3. **Interactions with Other Molecules**:
   - STAT3 interacts with other signaling molecules, including the Janus kinases (JAKs), which are responsible for its phosphorylation. Furthermore, the context mentions soluble forms of the IL-6 receptor (sIL-6Rα) and soluble gp130 (sgp130), which influence the activity of STAT3 by modulating the availability and activity of the IL-6 signaling complex.
   - It also indirectly interacts with acute-phase proteins like C-reactive protein (CRP), with IL-6-induced STAT3 activity leading to increased CRP expression.

4. **Importance in Biological Systems**:
   - STAT3 plays a pivotal role in controlling inflammatory responses, promoting cellular growth and differentiation, particularly in response to IL-6 signaling, a critical regulator in immune responses and inflammation.
   - In diseases such as Crohn’s disease, increased levels of pSTAT3 have been associated with disease activity, highlighting its importance in the pathology and as a potential therapeutic target.

In summary, STAT3 is a central player in the IL-6 signaling pathway, influencing diverse biological processes and contributing to the pathology of various inflammatory diseases. Its regulation and interaction with other components make it a vital molecule in cellular signaling and a focal point in systems biology modeling."
mw39c2e431_fdc3_4964_be29_6ca856620b1b,pSTAT3,"Based on the context provided, pSTAT3 is the phosphorylated form of STAT3 (Signal Transducer and Activator of Transcription 3). Here is a summary of its relevant biological functions and roles based on the provided context and general knowledge:

1. **Biological Function**: 
   pSTAT3 is a transcription factor that is activated through phosphorylation. This phosphorylation is primarily mediated by the Janus kinase (Jak) pathway, which is activated upon stimulation by cytokines such as interleukin 6 (IL-6). Once phosphorylated, pSTAT3 dimerizes and translocates to the cell nucleus, where it binds to specific DNA sequences to regulate the transcription of various genes.

2. **Role in Pathways**:
   - **IL-6 Signaling Pathway**: pSTAT3 acts as a critical intermediary in the IL-6 signaling cascade. The context suggests that IL-6 can facilitate pSTAT3 activation through both classical and trans-signaling mechanisms. Trans-signaling involves interactions with soluble IL-6 receptors (sIL-6R), while classical signaling involves membrane-bound IL-6 receptors.
   - **JAK/STAT Pathway**: This is the primary signaling pathway for the activation of STAT3, where cytokines activate receptor-associated JAKs, which in turn phosphorylate STAT3, leading to the generation of pSTAT3.

3. **Interactions with Other Molecules**:
   - pSTAT3 interacts with the IL-6 receptor complex, which includes IL-6, sIL-6R, and gp130 (both membrane-bound and soluble forms like sgp130). The complex formation leads to the activation of downstream signaling, with pSTAT3 being a pivotal output molecule that drives gene transcription.
   - SOCS (Suppressor of Cytokine Signaling) proteins are notable as negative regulators, limiting the activity of the JAK/STAT pathway and, consequently, pSTAT3 activity.

4. **Importance in Biological Systems**:
   The activation of pSTAT3 is associated with numerous cellular responses, including immune responses, inflammation, cell growth, and differentiation. Its presence and activity level in tissues like the gastrointestinal tract have been linked to inflammatory conditions, such as Crohn's Disease, as indicated by increased pSTAT3 in colon biopsies in such diseases. This highlights its importance in immune regulation and pathology.

5. **Clinical Relevance**:
   Due to its role in promoting inflammatory gene expression and cell proliferation, aberrant or prolonged activation of pSTAT3 is implicated in several diseases, including cancers and inflammatory bowel diseases. Therefore, it is a potential target for therapeutic interventions aimed at modulating immune responses or treating STAT3-driven pathologies.

In summary, pSTAT3 is a crucial molecule in cytokine signaling pathways, modulating gene expression and contributing to inflammatory and proliferative processes in various tissues. Its regulation, particularly in pathological contexts like inflammatory bowel disease, makes it a significant focus for biological modeling and therapeutic targeting."
mwd5313618_89eb_4c8c_bc82_66f10f966349,CRP,"C-reactive protein (CRP) is a well-known marker in biological systems, particularly for inflammation. In the context of the provided documents, CRP serves as a biomarker to assess inflammation levels and the effectiveness of certain treatments, such as those targeting interleukin-6 (IL-6) signaling pathways in conditions like Crohn's disease.

**Biological Function:**
CRP is an acute-phase protein produced by the liver. Its levels in the serum increase in response to inflammation caused by various factors, including infections and autoimmune diseases. CRP's primary biological function is to bind to the surface of dead or dying cells and some types of bacteria, thereby activating the complement system, which is a part of the immune response.

**Role in Pathways:**
CRP is heavily involved in the immune response, mainly through its interaction with IL-6. IL-6 is a cytokine that plays a critical role in inflammation and immune response, and it induces the production of CRP. This connection makes CRP a useful indicator for evaluating the activity of the IL-6 pathway in various diseases.

**Interactions with Other Molecules:**
- **IL-6 and IL-6Rα:** CRP production is stimulated by IL-6, which binds to IL-6 receptors and activates downstream signaling pathways that include the transcription of acute-phase proteins like CRP.
- **sgp130Fc:** The document mentions the use of sgp130Fc, an antagonist for IL-6 trans-signaling, suggesting interactions that potentially involve modulation of CRP levels when IL-6 signaling is inhibited.

**Importance in the Biological System Being Modeled:**
CRP is central to the evaluation and modeling of inflammatory responses. In the simulation and modeling context in the document, CRP levels are utilized to validate models predicting the effect of IL-6 pathway inhibitors. Elevated CRP levels are commonly used as a surrogate marker for inflammation, making it a crucial component for assessing and predicting the effectiveness of treatments aimed at reducing inflammatory responses, especially in conditions like Crohn's disease.

In summary, CRP's role as an indicator of inflammation, particularly through its interaction with the IL-6 pathway, makes it a critical focus in understanding and modeling inflammatory diseases and the effectiveness of treatments targeting these pathways."
mw2e464cf3_a09c_4b7c_9f3c_06720016a48e,sR,"The provided context primarily discusses the involvement of specific molecules and pathways related to the IL-6 signaling system, particularly focusing on the soluble interleukin-6 receptor (sIL-6R) and its interactions within the immune response system. However, it does not specifically mention a species or molecule identified solely as 'sR'. Given the context, it is possible to infer that 'sR' could refer to a soluble receptor component within this framework, possibly related to the IL-6 signaling pathway.

### Inferred Background Information about 'sR':

1. **Biological Function:**
   - If 'sR' refers to a soluble receptor like sIL-6R, it functions by binding to a cytokine (such as IL-6) and subsequently participating in signaling pathways that alter cellular responses. Soluble receptors often regulate the activity of cytokines by either enhancing their range and stability or modifying their interaction with membrane-bound receptors.

2. **Role in Pathways:**
   - In the context of IL-6 signaling, soluble receptors like sIL-6R can form complexes with IL-6 (IL-6:sR complex), which can interact with other receptor subunits such as the signal-transducing element gp130. This initiates downstream signaling cascades like the JAK/STAT pathway, which affects the expression of various genes involved in inflammation and immune response.

3. **Interactions with Other Molecules:**
   - Potential interactions for 'sR' include binding with cytokines like IL-6 and interacting with other receptor components or proteins such as gp130. The formation of IL-6:sR:sgp130 complexes is one noted interaction, suggesting a role in modifying the cytokine's activity and downstream effects.

4. **Importance in the Biological System:**
   - The presence of soluble receptors modulates the intensity and duration of cytokine signaling. In the context described, the dynamics of 'sR' could be crucial in fine-tuning immune responses, particularly in inflammatory conditions. The precise balance and levels of such components can significantly influence physiological functions and pathological outcomes.

Overall, while the context does not directly provide information about a species identified as 'sR', based on the descriptions of similar molecules, 'sR' may play a significant modulation role in cytokine signaling, impacting inflammation and immune system behavior."
mw36ea78c1_ed71_4def_96d3_857a442d7195,CRPExtracellular,"The context provided does not specifically mention a species or molecule named 'CRPExtracellular' with the exact ID given. However, based on the context and general biological knowledge, we can infer information about CRP, or C-reactive protein, which is mentioned multiple times.

CRP, or C-reactive protein, is a protein found in blood plasma, whose levels rise in response to inflammation. It is considered an acute-phase protein produced by the liver in the presence of cytokines, particularly interleukin-6 (IL-6). The following points summarize the potential background information about 'CRPExtracellular' based on the context:

1. **Biological Function**: CRP plays a critical role in the body's inflammatory response. It binds to the surface of dead or dying cells (and some types of bacteria) to activate the complement system, promoting phagocytosis by macrophages, which is part of the innate immune response.

2. **Role in Pathways**: CRP is a significant marker in inflammation pathways. The context mentions its suppression as an indicator of the efficacy of treatments targeting IL-6 signaling. The model used in the study predicts serum CRP levels as a marker to assess the impact of drug treatments on inflammatory processes, like those seen in Crohn’s disease.

3. **Interactions with Other Molecules**: CRP interacts with various components of the immune system, notably through its interaction with the complement system. However, the context primarily focuses on its relationship with IL-6 signaling. Antibodies targeting IL-6 or its receptor are shown to suppress CRP levels in the serum, reducing inflammation.

4. **Importance in the Biological System Being Modeled**: In the context of the model described, CRP serves as a critical biomarker for inflammation and the efficacy of therapeutic interventions. The suppression of serum CRP levels is used as an output to evaluate the success of different treatment strategies for diseases characterized by overactive inflammation, like Crohn's disease.

Given this information, 'CRPExtracellular' could refer to the presence of CRP in the extracellular fluid, where it exerts its effects and serves as an important marker for inflammation in the modeling system."
