id,name,background
mw147d30ec_478e_4090_b496_128a131d29eb,sgp130,"Based on the provided context, sgp130 appears to be a biological molecule involved in the regulation of IL-6 signaling pathways. Here's a detailed summary of the relevant background information about sgp130:

1. **Biological Function:**
   - sgp130 is a fusion protein that combines the extracellular portion of the glycoprotein gp130 with the Fc region of human IgG1. This fusion protein, referred to as sgp130Fc, functions primarily as an inhibitor of IL-6 trans-signaling. IL-6 is a cytokine that plays a crucial role in immune response, inflammation, and hematopoiesis.

2. **Role in Pathways:**
   - sgp130 is part of the signaling pathways involving IL-6 and its receptor organization. It specifically targets the IL-6/sIL-6Rα complex, preventing the propagation of IL-6 trans-signaling in cells, which can have various downstream effects on immune and inflammatory responses.

3. **Interactions with Other Molecules:**
   - sgp130 interacts with the IL-6/sIL-6Rα complex, binding it with the same affinity as the natural gp130 receptor. This interaction is significant because it hinders the complex's activity in trans-signaling pathways, which are mediated by the presence of soluble IL-6 receptors and contribute to various biological processes, including inflammation.

4. **Importance in the Biological System Being Modeled:**
   - In the context of this specific model, sgp130 plays a role in modulating the IL-6-mediated signaling pathways. However, the sensitivity analysis in the model indicated that altering sgp130 levels has minimal effect on the steady-state values of output parameters due to the excess presence of sgp130 relative to IL-6. Consequently, sgp130-based therapies might be less effective if the goal is to significantly alter these pathways or conditions like Crohn’s disease, as the system shows relative insensitivity to sgp130 changes.

In conclusion, sgp130 (as part of the sgp130Fc fusion protein) is primarily involved in the inhibition of IL-6 trans-signaling. Still, due to its high baseline level compared to IL-6, its impact on biological system dynamics may be limited without significant changes in sgp130 concentration."
mwab41493c_6349_45f1_a226_3030cfed0e06,sR_IL6_sgp130,"Based on the context provided and general knowledge of similar biological components, the species 'sR_IL6_sgp130' refers to complexes involving soluble IL-6 receptor components and the gp130 receptor protein. Here's a summary of the relevant information regarding these components:

1. **Biological Function:**
   - sR_IL6_sgp130 is likely involved in modulating the IL-6 signaling pathway. IL-6 is a cytokine that plays a critical role in immune responses, inflammation, and hematopoiesis.

2. **Role in Pathways:**
   - The document references IL-6 trans-signaling, it suggests that sR_IL6_sgp130 might be part of the mechanism to inhibit IL-6 signaling pathways. The soluble form of gp130 (sgp130) is noted as a negative regulator of IL-6 trans-signaling, which can act as a natural inhibitor by forming a complex with IL-6 and its soluble receptor sIL-6Rα, thus preventing further activation of membrane-bound gp130 receptor and subsequent signaling cascades.

3. **Interactions with Other Molecules:**
   - The context suggests that sgp130 interacts with the IL-6/sIL-6Rα complex. This interaction is essential because sgp130 cannot bind IL-6 directly unless IL-6 is associated with its soluble receptor, sIL-6Rα.

4. **Importance in the Biological System Being Modeled:**
   - In the context of inhibiting IL-6 trans-signaling, sgp130 (and likely sR_IL6_sgp130) plays a crucial role in maintaining balance by preventing excessive inflammatory responses. The simulations noted in the document suggest that therapeutically targeting sgp130 can have effects only at high doses, implicating its nuanced role in inflammation control through cytokine signaling pathways.

5. **Modeling and Implications:**
   - The system-level model mentioned discusses how sgp130 levels have little impact on steady-state parameters due to its high baseline concentration relative to free IL-6. This indicates sR_IL6_sgp130's role is more pronounced in scenarios where its concentration alters significantly, such as therapeutic applications for diseases like Crohn’s disease.

In summary, sR_IL6_sgp130 is integral to the regulation of IL-6 signaling, primarily acting as an inhibitor in inflammatory processes, and its high natural abundance helps modulate these pathways under normal physiological conditions.
"
mwf405687b_7401_44ec_a0d6_4a2b35c13e8a,Ab_sR,"Based on the provided context, there is no direct mention or specific information about the species 'Ab_sR' with ID: mwf405687b_7401_44ec_a0d6_4a2b35c13e8a. However, we can infer potential characteristics and roles of 'Ab_sR' by examining the context, which discusses interleukin-6 (IL-6) signaling pathways and associated molecules like soluble IL-6 receptor (sIL-6R) and C-reactive protein (CRP).

### Inferred Background Information about Ab_sR:

1. **Biological Function:**
   - If 'Ab_sR' is involved in the context of IL-6 signaling, it might be a receptor or a binding protein similar to sIL-6R. Soluble receptors often regulate cytokine activity by modulating their availability or by forming complexes that can engage in signaling.

2. **Role in Pathways:**
   - In the IL-6 signaling pathway, sIL-6R can form a complex with IL-6 that can interact with the signaling receptor gp130, initiating intracellular signaling cascades such as the JAK/STAT pathway. If 'Ab_sR' is analogous, it could play a role in modulating or facilitating such pathways.

3. **Interactions with Other Molecules:**
   - 'Ab_sR' may interact with cytokines like IL-6, potentially forming complexes that affect downstream signaling processes. Interaction with other receptors or signaling proteins such as gp130 is also a possibility if 'Ab_sR' serves a regulatory or modulating function similar to sIL-6R.

4. **Importance in the Biological System:**
   - In a biological system involving IL-6, components like sIL-6R are crucial for modulating inflammatory responses, highlighting their importance in immune regulation. Therefore, if 'Ab_sR' is part of this system, it may contribute significantly to balancing inflammatory signals and could be a target for therapeutic interventions aimed at controlling excessive inflammation.

Given the context's focus on IL-6 and its receptors, 'Ab_sR' might represent a component analogously involved in modifying immune responses or influencing chronic inflammation states, similar to how the sIL-6R functions in IL-6 signaling pathways."
mw3667a5e1_02c9_44a0_acb4_b0431faa822d,Ab,"The species denoted as 'Ab' in the context appears to refer to an antibody. Specifically, this antibody seems to play a role in targeting and potentially neutralizing components involved in inflammatory pathways. 

### Biological Function:
- The context suggests that 'Ab' is an antibody directed against interleukin-6 (IL-6) or its receptor(s), particularly the soluble IL-6 receptor alpha (sIL-6Rα). Antibodies in this context are proteins designed to bind to specific antigens, such as IL-6 or its receptor, effectively inhibiting their activity.

### Role in Pathways:
- The 'Ab' functions by engaging with and targeting the IL-6/sIL-6Rα complex, as part of a therapeutic mechanism aimed at reducing inflammation. This is evidenced by its usage in experiments modeling responses to treatment in conditions such as inflammatory bowel diseases (as indicated in other parts of the document).
- The targeting of this complex by the antibody is aimed at modulating immune responses, as IL-6 is a cytokine implicated in inflammatory and immune signaling pathways. 

### Interactions with Other Molecules:
- The antibody ('Ab') interacts specifically with IL-6 and sIL-6Rα. This interaction is significant because it prevents IL-6 from exerting its pro-inflammatory effects by blocking its interaction with cellular receptors or neutralizing it directly in circulation.
- The context also describes a dose-response relationship with serum C-reactive protein (CRP) suppression, which further underscores the antibody's role in inflammation modulation. CRP is an inflammatory marker, whose levels decrease with effective IL-6 pathway inhibition.

### Importance in the Biological System Being Modeled:
- 'Ab' is essential in the system due to its therapeutic potential in inflammatory diseases. By inhibiting IL-6 and its receptor's interaction, the antibody can help reduce pathological inflammation.
- This is particularly relevant in clinical scenarios where overactive IL-6 signaling contributes to disease progression, such as in certain autoimmune or inflammatory conditions.

Overall, 'Ab' is a critical component in the strategy for modulating inflammatory responses, highlighting its importance in both research and potential therapeutic applications."
mw772cbf20_3fc1_4800_ae59_77884f1ae333,Ab_R,"Based on the provided context from the documents, there is no specific mention or description of a biological species or molecule directly named 'Ab_R' with the ID provided. However, due to the context and typical content of systems biology research, we can infer some possibilities regarding what 'Ab_R' might represent, particularly in relation to antibodies or related biological components:

1. **Biological Function**: Given the context involving antibodies and their interactions with IL-6 receptors, 'Ab_R' could likely denote an antibody or a component related to antibody functions. Antibodies (Ab) are crucial components of the immune system, responsible for identifying and neutralizing foreign objects such as bacteria and viruses.

2. **Role in Pathways**: If 'Ab_R' is an antibody, it may play a role in immune signaling pathways, potentially as a therapeutic target or agent. Antibodies can either directly neutralize targets like IL-6 or IL-6Rα, or they can modulate signaling pathways by preventing these components from interacting and inducing inflammatory responses.

3. **Interactions with Other Molecules**: The documents discuss anti–IL-6 and anti–IL-6Rα antibodies, as well as their interactions and dose responses. If 'Ab_R' is related to these antibodies, it might interact with interleukins or receptors involved in inflammatory responses, specifically IL-6 and its receptor IL-6Rα, affecting pathways such as cytokine signaling and inflammation regulation.

4. **Importance in the Biological System Being Modeled**: In systems biology models, antibodies like 'Ab_R' can serve as model variables for predicting efficacy and outcomes of treatments targeting inflammatory pathways, such as those associated with chronic inflammatory diseases. The importance lies in their ability to modulate pivotal biochemical pathways, reduce inflammation markers such as CRP (C-reactive protein), and provide insights into therapeutic strategies.

In conclusion, without explicit information regarding 'Ab_R', the inference is that it might be an antibody related to the systems being studied, possibly playing a role in modulating inflammation through interactions with components like IL-6 and IL-6Rα."
mw2ba2b802_9f07_4f4d_94c6_24c8de1a95cf,Ab_sR_IL6,"Based on the context provided, there is no explicit mention of a species or molecule named 'Ab_sR_IL6' with the ID mw2ba2b802_9f07_4f4d_94c6_24c8de1a95cf. However, the documents discuss the interactions of antibodies with the IL-6/sIL-6Rα complex and the effects of targeting this interaction on immune regulation, specifically mentioning IL-6 and IL-6 receptor components such as sIL-6R (soluble IL-6 receptor).

Given this context, we can infer that 'Ab_sR_IL6' might represent an antibody related to the IL-6/sIL-6R interaction. Here is a generalized summary based on related knowledge about antibodies targeting the IL-6 pathway:

### Background Information on Potential 'Ab_sR_IL6':

- **Biological Function:** 'Ab_sR_IL6' is likely an antibody that targets the IL-6 signaling pathway, possibly binding to the soluble IL-6 receptor (sIL-6R) to modulate the interaction between IL-6 and its receptor.

- **Role in Pathways:** This antibody would play a role in interrupting or modulating the IL-6 signaling pathway, which is involved in various immune and inflammatory responses. By targeting sIL-6R, the antibody may inhibit downstream signaling events, such as the activation of STAT3 and subsequent transcription of inflammatory gene products.

- **Interactions with Other Molecules:** 'Ab_sR_IL6' may interact with sIL-6R, possibly preventing its interaction with IL-6 and the membrane-bound IL-6 receptor, thus affecting the formation of the IL-6/sIL-6R complex and its role in inflammatory signaling.

- **Importance in the Biological System:** The antibody's potential inhibition of IL-6 signaling can be critical in controlling overactive immune responses associated with diseases like Crohn’s disease and rheumatoid arthritis. By moderating this pathway, 'Ab_sR_IL6' may contribute to the suppression of inflammatory markers such as C-reactive protein (CRP).

This inference is made based on the context of targeting IL-6/sIL-6R pathways in therapeutic models and the general strategy of using monoclonal antibodies to modulate immune-related pathways."
mw7becb5fe_8da8_4285_a821_0d77ad811b62,sR_IL6,"Based on the context provided, specific information about the species named 'sR_IL6' (ID: mw7becb5fe_8da8_4285_a821_0d77ad811b62) is not directly mentioned. However, we can infer information based on the context regarding similar molecules like IL-6 and sIL-6R.

### General Inference on sR_IL6:

1. **Biological Function:**
   - IL-6 is a cytokine involved in immune response regulation, often signaling through pathways that involve soluble receptors, such as sIL-6R (soluble interleukin-6 receptor).
   - sIL-6R itself is instrumental in extending the range of IL-6 signaling to cells that do not naturally express the membrane-bound IL-6 receptor.

2. **Role in Pathways:**
   - IL-6 can signal through two main pathways: classical signaling, where it binds to membrane-bound IL-6R, and trans-signaling, involving sIL-6R.
   - The IL-6/sIL-6R complex can be sequestered by sgp130, a soluble protein that modulates these pathways.
   - These pathways are crucial in inflammation and immune regulation, often involved in diseases like Crohn's disease.

3. **Interactions with Other Molecules:**
   - IL-6 interacts with sIL-6R to form a complex that can engage with other components like gp130 (glycoprotein 130) to facilitate signaling.
   - The context also suggests interactions with pharmacological agents, with antibody treatments targeting IL-6 or the IL-6/sIL-6R complex showing varying efficacy.

4. **Importance in the Biological System:**
   - In models focusing on immune regulation, especially in conditions like Crohn's disease, the IL-6/sIL-6R axis is critically evaluated for therapeutic targeting.
   - Understanding its role is key for developing treatments that modulate immune responses pathological conditions.

Overall, while 'sR_IL6' is not explicitly detailed in the documents, it can be inferred to have a function and role akin to soluble receptors facilitating cytokine signaling, with critical implications in inflammatory disease models."
mw8c9107e6_f51d_442d_b2dc_2bfdbb8482ca,gp130,"Gp130, also known as glycoprotein 130, is a crucial component of the interleukin-6 (IL-6) signaling pathway. It functions as a signal transducer in the receptor complex for IL-6, which plays a pivotal role in immune response, inflammation, and hematopoiesis. Gp130 itself does not bind IL-6 directly; instead, it forms part of the high-affinity receptor complex by associating with the IL-6/IL-6 receptor (IL-6R) complex. 

In the context of IL-6 signaling, gp130 is involved in classical signaling where it forms a hexameric structure with IL-6 and its membrane-bound IL-6R. Gp130 is also involved in trans-signaling, particularly through its interaction with soluble IL-6 receptor (sIL-6R). In this process, IL-6 can bind to sIL-6R, and the complex can then associate with gp130 on cells that do not express IL-6R, thereby expanding the range of cells responsive to IL-6 signaling.

The document mentions a fusion protein, sgp130Fc, designed to inhibit IL-6 trans-signaling. This suggests that soluble gp130 (sgp130) acts as a natural inhibitor of the IL-6/sIL-6R complex, potentially preventing it from binding to membrane-bound gp130, thereby attenuating downstream signaling. This property of sgp130 is being explored as a therapeutic approach for conditions like Crohn's disease.

In terms of its biological importance, gp130 is crucial for mediating normal and pathological responses through the IL-6 pathway. Its interactions with IL-6 and IL-6R complexes make it a significant player in inflammatory diseases and a potential target for therapeutic interventions aimed at modulating immune responses."
mw824bc3d4_1ac3_4912_9b51_8f14ff1c96b9,R_IL6_gp130,"Based on the context provided, it appears there is limited direct information about the species 'R_IL6_gp130' with the ID provided. However, we can synthesize and infer its role based on related information about similar biological components.

### Inferred Background Information about R_IL6_gp130:

- **Biological Function**: The naming 'R_IL6_gp130' suggests a complex involving Interleukin-6 (IL-6) and glycoprotein 130 (gp130). IL-6 is a cytokine involved in inflammatory and immune responses. gp130 is a signal transducing component of the IL-6 receptor complex. The complex's primary function is to mediate IL-6 signaling, which is crucial for the acute phase response and in regulating the immune and inflammatory responses.

- **Role in Pathways**: The IL-6/gp130 complex is involved in the signaling pathways that result in the activation of intracellular cascades such as the JAK/STAT pathway. This signaling is essential for modulating gene expression in various tissues and contributes to physiological and pathophysiological processes. Specifically, the IL-6/gp130 signaling pathway plays a significant role in the inflammatory response observed in diseases like Crohn's disease, as noted in the context.

- **Interactions with Other Molecules**: The context notes soluble forms of the receptor components, such as sgp130 and sIL-6R. These soluble factors can modulate IL-6 signaling by acting as competitive antagonists or facilitators of trans-signaling. The IL-6 can bind to its soluble receptor (sIL-6R), and the complex can then associate with both membrane-bound and soluble gp130 (sgp130) to continue the signal transduction process.

- **Importance in the Biological System**: The IL-6/gp130 signaling complex is crucial in managing systemic inflammatory responses and its dysregulation can lead to chronic inflammatory conditions. It is an important therapeutic target, as seen in the research modeling the use of sgp130Fc to inhibit IL-6 trans-signaling for treating conditions like Crohn's disease.

Overall, R_IL6_gp130 likely represents a functional interaction or complex in the IL-6 signaling pathway that plays a pivotal role in immune responses and inflammation. It is essential for understanding disease pathogenesis and designing therapeutic interventions targeting cytokine signaling."
mw6cce2109_0e32_4dd9_98ec_41173e8ef07d,Ractive,"The provided context does not contain direct information about the species named 'Ractive' with the specified ID. However, based on the context, which discusses a multiscale model of IL-6–mediated immune regulation in Crohn's Disease and involves components such as IL-6, IL-6Rα, and antibodies targeting these molecules, we can make some inferences.

1. **Biological Function**: Ractive might be a signaling molecule or a biological entity involved in immune regulation, potentially analogous to IL-6 or its receptor. Its function could involve modulation of immune responses, particularly in inflammatory conditions such as Crohn's disease or rheumatoid arthritis.

2. **Role in Pathways**: If Ractive functions similarly to IL-6 or its receptor, it may play a role in cytokine signaling pathways, which are crucial for immune system communication and regulation. These pathways often involve complex interactions and feedback mechanisms that control inflammation and immune response.

3. **Interactions with Other Molecules**: Ractive could interact with receptors or form complexes that facilitate or inhibit signal transduction. This is akin to how IL-6 interacts with sIL-6Rα, forming a complex that can activate signaling pathways.

4. **Importance in the Biological System**: In a model of immune regulation, Ractive could be important for understanding the dynamics of immune signaling, potentially serving as a target for therapeutic interventions in diseases characterized by dysregulated immune responses.

Without specific information, these inferences rely on general knowledge of molecules involved in cytokine signaling and immune modulation, similar to IL-6 and its receptor pathways."
mw2b255f94_8018_4b99_bde8_918eeac45446,STAT3,"STAT3, or Signal Transducer and Activator of Transcription 3, is a transcription factor involved in various biological processes, particularly in signal transduction pathways. It is activated through phosphorylation, which is triggered by upstream cytokine signaling, such as the interleukin-6 (IL-6) signaling pathway. This phosphorylation site on STAT3 is known as pSTAT3, where 'p' denotes its phosphorylated state.

**Biological Function:**
STAT3 serves as a key mediator in the cytokine signaling pathway that leads to the transcription of various genes. Upon activation, STAT3 translocates to the nucleus where it binds to specific DNA sequences to induce gene expression. The genes regulated by STAT3 are often involved in crucial biological processes such as immune response, cell growth, apoptosis, differentiation, and inflammation.

**Role in Pathways:**
STAT3 is prominently involved in the IL-6 signaling cascade. Within this pathway, IL-6 binding leads to the formation of a receptor complex that includes IL-6Rα and gp130, which then activates associated Janus kinases (JAKs). The JAK kinases phosphorylate STAT3, enabling its dimerization and subsequent nuclear translocation. In the nucleus, STAT3 acts on specific response elements to modulate the expression of target genes.

**Interactions with Other Molecules:**
STAT3 interacts with various components of the IL-6 signaling pathway, including the IL-6/sIL-6Rα complex and the gp130 receptor. Additionally, soluble gp130 (sgp130) can act as an inhibitor by sequestering the IL-6/sIL-6Rα complex, thereby modulating STAT3 activation. STAT3’s interactions are critical in modulating the inflammatory response as well as acute-phase reactions.

**Importance in Biological Systems:**
In the context of disease, STAT3-mediated trans-signaling is significant, particularly because it is involved in the upregulation of acute-phase proteins like C-reactive protein (CRP) and in immune responses within tissues such as the gastrointestinal tract and liver. Aberrant STAT3 signaling has been implicated in various pathological conditions, including cancers and inflammatory disorders like Crohn’s disease. In these contexts, STAT3's regulatory role on gene expression can impact cellular proliferation and differentiation, making it a valuable target for therapeutic interventions."
mw48867e93_f170_44e8_ac7a_185b23e1bf3b,pSTAT3,"pSTAT3, or phosphorylated Signal Transducer and Activator of Transcription 3, is a key molecule in the realm of cellular biology, particularly in the context of its involvement in various signaling pathways. Based on the provided context, here is a summary of pSTAT3's roles and interactions:

1. **Biological Function:**
   pSTAT3 is a phosphorylated form of the STAT3 protein, which functions as a transcription factor. Once activated, it translocates to the cell nucleus where it influences the transcription of various genes. This process is crucial for mediating cellular responses to cytokines and growth factors.

2. **Role in Pathways:**
   The context mentions pSTAT3 in connection with the IL-6 signaling pathway. IL-6 binds to its receptor IL-6R, and through the co-receptor gp130, initiates signaling cascades that lead to the activation (phosphorylation) of STAT3. This activation is implicated in ""trans-signaling"" which is a form of signaling where the ligand-receptor complex activates cells that do not express the IL-6 receptor.

3. **Interactions with Other Molecules:**
   pSTAT3 is involved in a sophisticated network of interactions:
   - It is downstream of the IL-6 signaling pathway, activated upon IL-6 binding to its receptor complex.
   - The phosphorylated STAT3 can induce expression of various genes including those encoding the suppressor of cytokine signaling (SOCS) proteins, which are negative regulators of cytokine signaling.
   - The context implies interactions with soluble forms of IL-6 receptor components, like sIL-6R and sgp130, which affect the signaling outcomes.

4. **Importance in the Biological System:**
   pSTAT3 is highlighted as an important signaling molecule in inflammatory responses, as noted in the mention of Crohn’s disease, an inflammatory bowel condition. In this context, elevated levels of pSTAT3 in colon biopsies suggest its role in mediating inflammatory processes. This underlines its importance not only in normal physiological responses but also in pathological conditions, making it a potential target for therapeutic intervention.

Overall, pSTAT3 plays a vital role in cytokine signaling pathways, particularly those involving IL-6, and is crucial for cellular functions that relate to inflammation, differentiation, and immune responses."
