id,name,background
mwf626e95e_543f_41e4_aad4_c6bf60ab345b,IL6,"Based on the provided context, IL6 (interleukin-6) is a cytokine that plays a vital role in immune regulation, particularly in the context of inflammatory diseases like Crohn's disease. Here is a summary of its background information:

1. **Biological Function:**
   - IL6 is a critical mediator in the immune system, known for its involvement in inflammation and immune responses.
   - It contributes to the survival of T-cells and resistance to apoptosis, especially in the lamina propria, a tissue region in the gut affected in Crohn’s disease.

2. **Role in Pathways:**
   - IL6 signaling occurs through two main pathways:
     - The classical pathway involves a membrane-bound IL-6 receptor (IL-6Rα).
     - The trans-signaling pathway involves a soluble IL-6 receptor (sIL-6Rα).
   - These pathways lead to the formation of a complex that activates the phosphorylation of gp130-bound Janus kinase (Jak) family proteins, followed by the phosphorylation of STAT3 (signal transducer and activator of transcription 3).

3. **Interactions with Other Molecules:**
   - IL6 forms a dimer/complex with IL-6Rα or sIL-6Rα, which then associates with a gp130 coreceptor to form a hexameric receptor complex.
   - This complex initiates downstream signaling critical for immune responses.
   - There are interactions with therapeutic antibodies, such as those targeting IL-6 or IL-6Rα, which can modulate its activity, an approach used in diseases like rheumatoid arthritis.

4. **Importance in the Biological System:**
   - In diseases like Crohn’s disease, IL6-mediated signaling is significant due to its role in promoting inflammatory responses and affecting chemokine secretion, leading to prolonged inflammation.
   - Targeting IL6 pathways is a therapeutic strategy used to control excessive inflammation and treat autoimmune diseases.

In conclusion, IL6 is a highly influential cytokine in immune regulation, particularly in inflammatory and autoimmune conditions, where it plays roles in cell survival, signaling pathways, and interactions with therapeutic agents."
mwbbbce920_e8dd_4320_9386_fc94bfb2fc99,sgp130,"Based on the provided context, the species 'sgp130' appears to be a component involved in the signaling pathways mediated by interleukin-6 (IL-6), specifically in the context of IL-6 trans-signaling. Here is a summary of relevant information about sgp130 based on the provided documents:

1. **Biological Function:**
   - sgp130 is a soluble form of gp130, which is involved in signal transduction for IL-6 and other cytokines.
   - It is involved in inhibiting IL-6 trans-signaling by binding to the IL-6/sIL-6Rα complex. This indicates that sgp130 can modulate inflammatory responses mediated by IL-6.

2. **Role in Pathways:**
   - sgp130 specifically inhibits IL-6 trans-signaling, which typically occurs when the IL-6/sIL-6Rα complex interacts with membrane-bound gp130 on target cells. By binding with the complex, sgp130 prevents this interaction, potentially reducing pathological signaling associated with diseases such as Crohn’s disease.

3. **Interactions with Other Molecules:**
   - sgp130 interacts with the complex formed by IL-6 and its soluble receptor, sIL-6Rα. This interaction is a key mechanism by which sgp130 exerts its inhibitory effects on IL-6 mediated signaling.

4. **Importance in the Biological System:**
   - The context indicates that sgp130 is present in high baseline concentrations compared to IL-6, suggesting its physiological role as a moderator of IL-6 activity.
   - The high baseline level of sgp130 and its excess relative to IL-6 suggest that it can effectively suppress IL-6 trans-signaling under normal conditions.
   - The model described suggests that despite its high concentration, sgp130 has a minimal effect on system dynamics unless present in very high doses. This may reflect the physiological buffering role it plays to protect against excessive IL-6 activity.
   - However, sgp130-based therapies may not be as effective as treatments targeting IL-6 or sIL-6Rα directly, due to its relatively lower influence on the system dynamics in terms of biomarker changes.

In summary, sgp130 is important as a regulatory molecule in cytokine signaling pathways, particularly those involving IL-6, with potential therapeutic implications in modulating inflammatory and immune responses."
mw810ff751_fa4e_4143_bd50_169b3e325e1e,sR_IL6_sgp130,"Based on the provided context, 'sR_IL6_sgp130' is likely a component that is involved in the IL-6 signaling pathway, which is known to play a crucial role in inflammatory responses and immune regulation. The context refers to sgp130, which is described as a fusion protein that combines the extracellular portion of gp130 with the Fc region of human IgG1. This fusion protein, named sgp130Fc, is used to inhibit IL-6 trans-signaling.

### Biological Function:
sR_IL6_sgp130 is not directly mentioned in the text, but based on similar components, it likely functions to modulate the IL-6 signaling pathway. In particular, sR_IL6_sgp130 might interact with the IL-6/sIL-6R complex, playing a role in inhibiting the trans-signaling process.

### Role in Pathways:
The IL-6 signaling pathway is addressed in the context of both Classical and Trans signaling. While classical signaling involves IL-6 binding to membrane-bound IL-6 receptor (IL-6R) and gp130, trans-signaling involves IL-6 binding to soluble IL-6R (sIL-6R), allowing it to interact with gp130 on cells that do not express IL-6R. sR_IL6_sgp130 would participate in the inhibition of trans-signaling by binding to the IL-6/sIL-6R complex.

### Interactions with Other Molecules:
In the context of the modeling study, sgp130Fc is assumed to bind the IL-6/sIL-6R complex with similar affinity to natural sgp130. This suggests that sR_IL6_sgp130 might also interact with IL-6, sIL-6R, and potentially compete or interfere with their binding to gp130, effectively inhibiting signaling pathways downstream.

### Importance in the Biological System:
The presence of sgp130 in excess compared to free IL-6 indicates its potential role as a regulatory buffer in the signaling pathway. The study suggests that the system's sensitivity to changes in sgp130 levels is low unless there are significant deviations from baseline levels. This implies that while sgp130 (and by extrapolation, sR_IL6_sgp130) is important, its effects on the system dynamics are subtle unless present in large amounts, reaffirming its regulatory role.

In summary, sR_IL6_sgp130 is inferred to be a critical modulator in the IL-6 signaling pathway, particularly involved in regulating the trans-signaling pathway by interacting with the IL-6/sIL-6R complex and potentially influencing inflammatory and immune responses."
mw114aa90f_5f5b_4fe8_9406_361c8489b6a1,CRP,"Based on the provided context, CRP, or C-reactive protein, is a biomarker commonly used to assess inflammation in the body. Here is a summary of relevant background information regarding CRP:

1. **Biological Function**: CRP is a protein found in the blood, produced by the liver, and its levels increase in response to inflammation. It is part of the body's acute phase response to inflammation, infection, or injury.

2. **Role in Pathways**: CRP is a key inflammatory marker often assessed in clinical settings to evaluate inflammation levels. It is used to monitor diseases like Crohn's disease, where inflammation is a characteristic feature. The context suggests its levels are affected by treatments targeting IL-6 signaling, which is a pathway involved in immune responses and inflammation.

3. **Interactions with Other Molecules**: The context highlights interactions between CRP and interleukin-6 (IL-6) signaling pathways. IL-6 is a cytokine that activates the acute phase response, leading to increased CRP production. Treatments that target IL-6 or its receptor (IL-6Rα) can lead to a decrease in CRP levels by mitigating inflammation.

4. **Importance in the Biological System Being Modeled**: CRP serves as a significant marker for inflammation in the model described. The model evaluates the effectiveness of different treatment strategies for managing inflammation, particularly in conditions like Crohn's disease, by measuring changes in CRP levels. The modulation of CRP through therapeutic interventions indicates the model's ability to simulate the inflammatory response to drug treatments.

Overall, CRP is critical for monitoring and understanding inflammatory processes and the effectiveness of interventions in inflammatory diseases."
mw30ae63db_6cd3_4b6f_93ad_3350cd360bcc,sR,"From the provided documents, there is no specific mention of a species named 'sR' with the ID mw30ae63db_6cd3_4b6f_93ad_3350cd360bcc. However, there are references to molecules and components related to the IL-6 signaling pathway, such as sIL-6R (soluble IL-6 receptor) and sgp130, which are involved in IL-6 mediated signaling.

### Inferred Background Information about 'sR':

1. **Biological Function:**
   - Based on similar naming conventions, 'sR' could potentially refer to a soluble receptor or a molecule that has a regulatory or auxiliary role in signaling pathways, possibly related to cytokine signaling like IL-6.

2. **Role in Pathways:**
   - If 'sR' is associated with processes similar to sIL-6R, it may be involved in modulating cytokine actions. Soluble receptors like sIL-6R often bind cytokines in the bloodstream, influencing their bioavailability and activity.

3. **Interactions with Other Molecules:**
   - Soluble receptors typically interact with ligands or other receptor components (e.g., cytokines such as IL-6). They may act as either inhibitors by sequestering the ligand or enhancers by stabilizing receptor complexes.
   - Related interactions could involve complex formation with cytokine molecules and possibly other receptors such as gp130.

4. **Importance in the Biological System Being Modeled:**
   - In the context of the IL-6 signaling described, 'sR' may play a role in modulating inflammatory responses or other gene expression pathways through its interaction with signaling molecules.
   - It might be significant in balancing the dynamics of cytokine signaling, similar to how sgp130 is described as having minimal immediate impacts unless present in vastly altered concentrations.

Since there is no explicit information on 'sR', the above inferences are drawn from typical functions and roles of soluble receptors in cytokine signaling pathways as exemplified by the mentioned components like sIL-6R."
mw03db56ac_8dc6_4931_ae82_fef706d2ee3d,sR_IL6,"Based on the provided context and general knowledge about similar biological components, the species ""sR_IL6"" appears to refer to the soluble receptor component related to the cytokine Interleukin-6 (IL-6). Below is a summary of relevant background information:

1. **Biological Function**:
   - sR_IL6, likely reflecting ""soluble IL-6 receptor"" (sIL-6R), is a part of the IL-6 signaling pathway. This soluble receptor can bind to IL-6, allowing it to interact with gp130, a signal-transducing receptor component, and mediate downstream signaling.
   
2. **Role in Pathways**:
   - IL-6 can signal through classical and trans-signaling pathways. The classical pathway involves the membrane-bound IL-6 receptor, while the trans-signaling pathway involves the soluble IL-6 receptor (sIL-6R). In the latter, sR_IL6 binds to IL-6, forming a complex that can interact with membrane-bound gp130 to initiate intracellular signaling cascades.

3. **Interactions with Other Molecules**:
   - sR_IL6 forms a complex with IL-6, known as the IL-6/sIL-6R complex. This complex can be sequestered by another protein called sgp130, which negatively regulates IL-6 signaling by preventing it from interacting with cell surface gp130.
   - The interaction between IL-6/sR_IL6 and gp130 leads to the activation of the Jak/STAT3 signaling pathway, which is pivotal for mediating immune and inflammatory responses.

4. **Importance in the Biological System**:
   - The soluble receptor sR_IL6 is important in expanding the range of cells that can respond to IL-6, as not all cells express the membrane-bound IL-6 receptor. Through trans-signaling, it facilitates cellular responses in a broader repertoire of cell types, including those implicated in inflammation and immune responses.
   - In the context of the multiscale model outlined in the document, sR_IL6 and its interactions are crucial in understanding mechanisms underlying diseases such as Crohn's disease and in evaluating therapeutic interventions targeting IL-6 signaling pathways.

In summary, sR_IL6 plays a significant role in mediating IL-6-related signaling pathways, influencing immune regulation and inflammation, and is a critical component in the computational modeling of related diseases."
mwf345ed7a_0622_403c_b816_c8749a2c9ded,Ab,"The context provided from the documents appears to be focused on a biological or pharmacological study, particularly related to the immune response involving interleukin pathways and potentially antibodies. However, there is no direct information or explicit mention of the species or molecule named 'Ab' with the ID provided. 

Based on the typical use of ""Ab"" in biological contexts, especially when mentioned alongside dose response and serum concentrations, it likely refers to an antibody. The context involves interactions within the IL-6 signaling pathway, common in studies involving inflammatory diseases such as Crohn’s disease (CD), and it details the effects of targeting interleukin-6 (IL-6), its receptor (IL-6Rα), and their complex. 

Given this information, 'Ab' could refer to:

1. **Biological Function**: 'Ab' functions as an antibody, possibly designed to bind to specific antigens like IL-6 or IL-6Rα, potentially modulating immune responses by inhibiting these targets to reduce inflammation or related symptoms.

2. **Role in Pathways**: It plays a role in the IL-6 signaling pathway, likely targeting either IL-6, IL-6Rα, or their complex, which is crucial in mediating inflammatory responses.

3. **Interactions with Other Molecules**: 'Ab' would interact with IL-6, IL-6Rα, and possibly the IL-6/sIL-6Rα complex. This interaction aims to reduce the signaling through the IL-6 pathway, which is implicated in inflammatory processes.

4. **Importance in the Biological System Being Modeled**: In the context of this study, 'Ab' is an important therapeutic agent intended to suppress inflammatory markers such as C-reactive protein (CRP), as suppression of CRP would indicate reduced inflammation, which is crucial in diseases like inflammatory bowel diseases.

Overall, while explicit information on 'Ab' is not provided, it can be inferred that 'Ab' is an antibody used to intervene in inflammatory signaling pathways by targeting components of the IL-6 signaling system."
mw1da111f2_a036_4392_8512_015005bdcbb7,Ab_sR,"The context provided does not contain specific information about the species named 'Ab_sR' (ID: mw1da111f2_a036_4392_8512_015005bdcbb7). However, we can infer certain aspects based on the context and general biological knowledge related to similar components.

In the context given, there are discussions around IL-6 (Interleukin-6), sIL-6R (soluble IL-6 receptor), and their interactions. These are critical components of the IL-6 signaling pathway, which is significant in the regulation of immune responses, inflammation, and hematopoiesis. Particularly, the IL-6/sIL-6R complex is involved in the trans-signaling pathway, affecting various biological processes, such as acute-phase protein production in the liver (e.g., CRP - C-reactive protein) and potentially impacting inflammation and immune response regulation.

Given this context, if 'Ab_sR' is presumed to be a molecule or species related to these pathways, it might play a role in interacting with IL-6 or its receptor components, such as sIL-6R, thereby influencing the pathway's function. If 'Ab_sR' is akin to an antibody, as suggested by the prefix ""Ab,"" it might be involved in modulating the IL-6 signaling through binding to IL-6, sIL-6R, or the IL-6/sIL-6R complex, potentially affecting immune signaling and inflammation.

If 'Ab_sR' has an inhibitory function similar to that of an antibody targeting IL-6 or sIL-6R, it could contribute to downregulating excessive inflammatory responses, thus playing a protective role in conditions characterized by inflammation, like autoimmune diseases or chronic inflammatory states. 

In summary, without explicit details, 'Ab_sR' might be theorized to interact within the IL-6 signaling pathway, potentially moderating its activity and influencing broader biological functions related to inflammation and immune response regulation."
mw9947742a_0e4b_4636_9a4b_b6eef2a8f6ac,Ab_sR_IL6,"From the context provided, there is no direct mention of a biological species or molecule named 'Ab_sR_IL6'. However, I can infer what it might be based on the context and general understanding of similar biological components.

Given the provided context, which involves IL-6 (Interleukin-6) and sIL-6R (soluble Interleukin-6 receptor), it is likely that 'Ab_sR_IL6' refers to an antibody directed against a complex involving these molecules. Here’s a possible breakdown of what 'Ab_sR_IL6' might represent based on the context:

1. **Biological Function:**
   - If 'Ab_sR_IL6' stands for an antibody targeting the soluble IL-6 receptor (sIL-6R) or the IL-6/sIL-6R complex, its primary biological function would be to inhibit the interaction of IL-6 with its receptor. This can prevent downstream signaling pathways that are activated by IL-6 binding, which are known to play roles in inflammatory and immune responses.

2. **Role in Pathways:**
   - IL-6 is involved in the JAK/STAT signaling pathway, leading to the activation of STAT3 and transcription of specific genes, including ones involved in inflammation. The antibody would act to disrupt this signaling pathway by preventing IL-6 from binding to the sIL-6R and further associating with the membrane-bound IL-6 receptor (IL-6R) and gp130, a signal transducer molecule.

3. **Interactions with Other Molecules:**
   - The 'Ab_sR_IL6' likely interacts with sIL-6R or the IL-6/sIL-6R complex to form a binding complex that prohibits IL-6-related signaling cascades.
   - This interaction would affect the circulation of IL-6 and sIL-6R, and consequently, the levels of C-reactive protein (CRP) in systems such as the liver, as indicated by the discussion around CRP suppression.

4. **Importance in the Biological System Being Modeled:**
   - In the context of immune regulation, particularly relating to conditions like Crohn’s disease or rheumatoid arthritis, inhibiting IL-6 signaling through the action of the antibody could provide therapeutic benefits by reducing inflammation.
   - The model suggests that targeting both IL-6 and IL-6/sIL-6R (potentially by an antibody like 'Ab_sR_IL6') might yield enhanced therapeutic benefits compared to targeting IL-6 alone.

This inference leverages general knowledge about the IL-6 pathway and common antibody strategies in therapeutic interventions."
CRP_Suppression___,CRP Suppression (%),"Based on the context provided, ""CRP Suppression (%)"" appears to be a measurement or output rather than a biological species or molecule. It is related to the suppression or reduction of serum C-reactive protein (CRP) levels, which can be tracked as a percentage decrease from baseline levels. Here is the inferred background information:

1. **Biological Function**: CRP is a protein produced by the liver in response to inflammation. It is a common marker used in clinical settings to assess acute inflammation and is part of the immune response.

2. **Role in Pathways**: CRP is part of the inflammatory response pathway. It is typically upregulated in response to pro-inflammatory cytokines such as Interleukin-6 (IL-6). The context suggests that anti-IL-6 or anti-IL-6 receptor (IL-6R) treatments are being used to modulate CRP levels by reducing inflammation.

3. **Interactions with Other Molecules**: In the context of anti-IL-6 and anti-IL-6R treatments, CRP levels are affected by these interventions, which target the IL-6 signaling pathway. The suppression of CRP is used as an indicator of the effectiveness of these treatments, implying that IL-6 and its receptor play significant roles in the regulation of CRP levels.

4. **Importance in the Biological System**: The reduction in serum CRP levels, reflected as ""CRP Suppression (%)"", is used as a biomarker to assess the efficacy of treatments targeting IL-6 signaling. This makes CRP suppression a crucial readout in models studying inflammation and therapeutic interventions aimed at reducing inflammation.

Therefore, while ""CRP Suppression (%)"" is not a biological species or molecule, it serves as a quantitative measure of the effectiveness of interventions targeting inflammation, specifically through the IL-6 pathway. The context indicates its use in evaluating the impact of various anti-inflammatory strategies."
CRP____of_baseline,CRP (% of baseline),"Based on the provided context and general knowledge, here is the background information about ""CRP (% of baseline)"":

1. **Biological Function**:
   - CRP stands for C-reactive protein, which is a substance produced by the liver in response to inflammation. It is a well-known biomarker for inflammation and can indicate the presence of inflammatory diseases or other conditions.

2. **Role in Pathways**:
   - CRP is involved in the immune system's response to inflammation. It functions by binding to lysophosphatidylcholine on the surface of dead or dying cells and some types of bacteria. This binding activates the complement system via C1q, promoting phagocytosis by macrophages, which is a key component of the immune response to infection or injury.

3. **Interactions with Other Molecules**:
   - CRP interacts with other molecules within the immune system, such as complement proteins. In the context of the provided documents, CRP levels are used as an indicator of inflammation reduction in response to anti-IL-6Rα therapy. CRP levels decrease when the therapy is effective, signaling reduced inflammation.

4. **Importance in the Biological System Being Modeled**:
   - In the context of the provided documents, CRP (% of baseline) is a crucial measure used to evaluate the efficacy of a treatment involving anti–IL-6Rα (tocilizumab) antibodies. Tocilizumab is used to treat immune-mediated conditions by blocking the interleukin-6 receptor (IL-6Rα), thereby reducing inflammation. Monitoring CRP levels over time allows researchers to confirm the treatment's impact on systemic inflammation.

The term ""CRP (% of baseline)"" refers to the proportion of CRP levels at any given time point compared to the initial baseline level before treatment commenced. This percentage allows researchers to assess changes in CRP concentration as a direct result of therapeutic interventions, providing insights into how effectively the treatment controls inflammation."
mw80848184_e2dd_47ce_86d7_7a21479342bd,gp130,"Gp130 is an important protein involved in the cytokine signaling pathway, particularly in relation to interleukin-6 (IL-6) signaling. It acts as a signal transducer for the IL-6 family of cytokines and plays a critical role in the assembly and function of cytokine receptor complexes. Specifically, gp130 serves as a common signal transducing subunit for the IL-6 receptor complex, which includes the IL-6 receptor alpha (IL-6Rα) and the IL-6 cytokine itself.

### Biological Function:
- **Signal Transduction**: Gp130 participates in transmitting signals from the IL-6/IL-6Rα complex inside the cell, resulting in various biological responses. It forms a hexameric complex with IL-6 and its receptor, which is crucial for initiating downstream signaling pathways.
- **Regulator Role**: Soluble gp130 (sgp130) acts as a natural inhibitor of IL-6 trans-signaling. It binds to the IL-6/sIL-6Rα complex, preventing its interaction with membrane-bound gp130, thus modulating the activity of IL-6.

### Role in Pathways:
- **IL-6 Pathway**: Gp130 is fundamental in the IL-6 signal transduction pathway. It is involved in the initiation of cascades like the JAK/STAT pathway, which is important for gene expression and immune response regulation.
- **Inflammatory Response**: Through its interaction with IL-6, gp130 is implicated in the inflammatory response and has been linked to diseases such as Crohn's disease.

### Interactions with Other Molecules:
- **Complex Formation**: Gp130 interacts with IL-6 and soluble IL-6Rα to form a signaling complex. This interaction is necessary for the proper signal transduction and is the target for various therapeutic interventions.
- **Therapeutic Applications**: Fusion proteins like sgp130Fc are designed to inhibit IL-6 trans-signaling by binding the IL-6/sIL-6Rα complex, which is being explored for therapeutic use in inflammatory diseases like Crohn’s.

### Importance in Biological Systems:
- **Regulatory Mechanism**: Gp130 serves as a key regulatory mechanism in cytokine signaling, influencing immune system activity and inflammation.
- **Disease Targeting**: Because of its central role in cytokine signaling, particularly in inflammatory pathways, gp130 and its soluble form are subjects of therapeutic interest, aiming to manage chronic inflammatory conditions.

In summary, gp130 is a critical component in cytokine receptor signaling, primarily involved in IL-6-related pathways, playing a significant role in immune responses and being a potential point of interference for therapeutic strategies in inflammatory diseases."
