id,name,background
mw0083d743_836f_4238_a17f_4602193d5bc0,geneProduct,"The context provided does not specifically mention the species or molecule identified by the name 'geneProduct' with the ID mw0083d743_836f_4238_a17f_4602193d5bc0. However, based on the context surrounding interactions with IL-6, sIL-6R, and sgp130, we can infer some potential roles and characteristics that a typical gene product may exhibit within this biological system, particularly related to IL-6 signaling.

1. **Biological Function**: 
   - The reference to various gene products in conjunction with IL-6 pathways suggests that geneProduct might be involved in signaling pathways or could encode proteins that participate in immune responses. IL-6 is known to be a cytokine that plays a significant role in inflammation and the immune response.

2. **Role in Pathways**:
   - Gene products in the context of IL-6 are likely to be involved in mediating inflammatory responses or immune regulation. They could be participating in pathways involving Jak-STAT signaling, which is mentioned alongside IL-6 signaling processes in the text.

3. **Interactions with Other Molecules**:
   - The gene product could potentially interact with components of the IL-6 signaling pathway, such as the IL-6 receptor (IL-6R), soluble IL-6R (sIL-6R), and the signal transducer gp130. These interactions could influence downstream signaling cascades leading to diverse cellular responses.
   
4. **Importance in the Biological System Being Modeled**:
   - Considering the text emphasizes IL-6 signaling and its regulatory mechanisms, the gene product likely holds importance in modulating immune responses or inflammation. It might contribute to the fine-tuning of the system's response to inflammatory stimuli or be a target for therapeutic interventions to manage conditions related to excessive inflammation.

Although specific details about the geneProduct are not mentioned in the provided context, understanding general roles of other gene products in similar pathways suggests potential functions and interactions that could be applicable."
mwd31f52cc_04e7_40e0_885f_c7b2d9e62215,sR,"Based on the provided context, the species named 'sR' appears to be associated with IL-6 signaling pathways. While the document doesn't explicitly detail the specific properties or function of 'sR', we can infer its potential role from related components mentioned, such as sIL-6R and sgp130.

1. **Biological Function and Role in Pathways**:
   - **sR** likely stands for a soluble receptor, analogous to sIL-6R (soluble Interleukin-6 Receptor), a well-known component in the IL-6 signaling pathway.
   - Soluble receptors like sIL-6R can enhance the spectrum of the cytokine's action, allowing IL-6 to affect cells that do not express membrane-bound receptors.
   - In the IL-6 signaling pathway, these molecules participate in the ""trans-signaling"" mechanism, where soluble receptors (e.g., sIL-6R) bind to IL-6, and this complex can then interact with membrane-bound gp130 on cells, initiating downstream signaling events.

2. **Interactions with Other Molecules**:
   - The context mentions interactions between IL-6, sIL-6R, and sgp130. It's likely that 'sR' interacts with one or more of these molecules, possibly forming a complex with IL-6 that subsequently engages with cell surface components like gp130.
   - sgp130 acts as a natural inhibitor in the IL-6 signaling pathway by competitively inhibiting the binding of the IL-6/sIL-6R complex to cell surface gp130, thus regulating IL-6 trans-signaling activities.

3. **Importance in the Biological System**:
   - While the specific importance of 'sR' is not detailed, by analogy to sIL-6R, it could be critical in mediating and regulating responses to IL-6 in varied tissues, influencing gene expression changes and physiological responses.
   - Alterations in its concentration, similar to sgp130, may have implications for the dynamics of the signaling pathway, with potential roles in inflammatory responses, metabolism, or immune regulation.

In summary, although 'sR' is not specifically described, it is likely a component similar to sIL-6R, involved in facilitating IL-6 signaling through the trans-signaling pathway, with important interactions and regulatory roles in biological systems involving inflammatory responses."
mw2c9b0499_3325_4394_8af3_bbf653a944a0,IL6,"Based on the provided context, here is the background information about the molecule IL-6:

### Biological Function
IL-6 (Interleukin 6) is a cytokine that plays a crucial role in immune regulation. It is involved in various immune responses, inflammation, and hematopoiesis (formation of blood cellular components).

### Role in Pathways
IL-6 can signal through two main pathways:
1. **Classical Signaling Pathway:** Involves the membrane-bound IL-6 receptor (IL-6Rα). IL-6 binds to IL-6Rα, forming a dimer, which then associates with the gp130 receptor to form a hexameric complex. This complex triggers the phosphorylation of Janus kinase (Jak) family proteins and subsequently activates the STAT3 (Signal Transducer and Activator of Transcription 3) pathway.
2. **Trans-signaling Pathway:** Involves the soluble IL-6 receptor (sIL-6Rα). IL-6 binds to sIL-6Rα, and this complex interacts with gp130 on cell surfaces, similarly initiating the Jak/STAT3 signaling cascade.

### Interactions with Other Molecules
IL-6 interacts with both its membrane-bound and soluble receptors (IL-6Rα and sIL-6Rα) to mediate its biological effects. The subsequent activation of gp130 and Jak/STAT3 signaling pathways is a key interaction. IL-6 also interacts with antibodies that target either IL-6 itself or its receptor, influencing signal suppression, which has therapeutic implications.

### Importance in the Biological System Being Modeled
In the context of Crohn’s Disease, IL-6 is a significant contributor to the disease pathology. It enhances T-cell survival and apoptosis resistance in the intestinal lamina propria, leading to increased secretion of chemokines. This exacerbates the inflammatory response, making IL-6 a critical target for therapeutic interventions in Crohn's Disease. The suppression of IL-6 signaling through antibodies such as tocilizumab is of interest in controlling disease progression.

This information contextualizes the role of IL-6 in immune modulation, particularly its contribution to inflammatory diseases such as Crohn's Disease, and underscores its importance as a therapeutic target."
mwd65b5b39_dc1b_4e77_a999_67277a880e5e,sgp130,"sgp130, as described in the context, refers to a biological molecule associated with the inhibition of IL-6 trans-signaling. It is a fusion protein that combines the extracellular portion of gp130 with the Fc region of human IgG1, known as sgp130Fc. This fusion protein has been experimentally shown to inhibit the IL-6/sIL-6Rα complex in cultured cells. sgp130 acts by binding to this complex, thus playing a role in modulating inflammatory pathways that are mediated by IL-6 trans-signaling.

The molecule is particularly relevant in the context of therapeutic approaches for inflammatory diseases such as Crohn's disease. The document mentions simulations of intravenous dosing of sgp130Fc, which highlight its therapeutic potential, although its effectiveness is noted to be significant only at high and frequent doses. This suggests a potential therapeutic limitation due to the high baseline level of sgp130 in comparison to free IL-6, indicating that small changes in sgp130 levels have a minimal effect on system dynamics.

In terms of its role in biological pathways, sgp130's primary function in this context is the regulation of the IL-6 trans-signaling pathway. It interacts specifically with the IL-6/sIL-6Rα complex, preventing the signaling cascade that would normally be activated by the interaction of IL-6 with its receptors. This interaction is crucial for reducing inflammation, especially in cases like Crohn's disease.

In summary, sgp130 is important in systems biology as an inhibitor of the IL-6 trans-signaling pathway, possessing potential therapeutic uses in inflammatory diseases. However, its effectiveness is contingent upon achieving high concentrations due to its already high baseline levels compared to IL-6, thus making its role in modulating the pathway somewhat limited under normal physiological conditions."
mw6335d5d7_c7b0_4bc0_b883_f7ee4915c2c3,sR_IL6_sgp130,"The species 'sR_IL6_sgp130' likely refers to a soluble form of the glycoprotein gp130 that interacts with the interleukin-6 (IL-6) signaling complex. From the context provided, it can be inferred that sR_IL6_sgp130 is involved in the inhibition of IL-6 trans-signaling pathways. Here is a breakdown of the potential role and importance of sR_IL6_sgp130 based on the provided text and general biological knowledge:

1. **Biological Function**: sR_IL6_sgp130 likely functions as an inhibitor of the IL-6 trans-signaling pathway. Trans-signaling involves the interaction of IL-6 with its soluble receptor sIL-6Rα, which can then associate with membrane-bound or soluble gp130 to activate signaling. The role of sR_IL6_sgp130 would be to interrupt this process, thus modulating the cellular response to IL-6.

2. **Role in Pathways**: In the context of IL-6 signaling, gp130 is a signal-transducing receptor component. Inhibition of the IL-6/sIL-6Rα complex formation by sR_IL6_sgp130 would prevent downstream signaling events such as the activation of the JAK/STAT pathway and its associated transcriptional activities (e.g., induction of CRP production in the liver).

3. **Interactions with Other Molecules**: sR_IL6_sgp130 interacts directly with the IL-6/sIL-6Rα complex. By binding to this complex, it prevents the engagement and activation of membrane-bound gp130, thereby inhibiting downstream signaling.

4. **Importance in the Biological System**: The document suggests that while sR_IL6_sgp130 (or sgp130Fc, a pharmacological derivative) can inhibit IL-6-driven signaling pathways, its effectiveness is contingent on very high concentrations due to the high baseline levels of sgp130 compared to IL-6. This implies that sR_IL6_sgp130 serves as a regulatory element within the immune signaling framework, potentially acting as a buffer or modulator to prevent excessive or aberrant IL-6 signaling, which is relevant in pathologies like inflammation or autoimmune diseases.

In summary, sR_IL6_sgp130 plays a role as a modulator in IL-6 trans-signaling by binding to the IL-6/sIL-6Rα complex, thus preventing further signal transduction through gp130-mediated pathways. While it has potential therapeutic implications, particularly in inflammatory conditions, its impact in the modeled biological system requires larger perturbations to observe significant effects due to its existing baseline levels."
mwf7796221_1fea_4274_a93e_c00adbf5778c,Ab,"Based on the provided context, there is no direct mention of the species 'Ab' with the ID 'mwf7796221_1fea_4274_a93e_c00adbf5778c'. However, the context provides information on antibody interactions, specifically related to IL-6 and IL-6 receptor α (IL-6Rα), suggesting that 'Ab' might refer to an antibody involved in such interactions. Here’s an inferred background based on the context:

1. **Biological Function**: The abbreviation 'Ab' often refers to an antibody. Antibodies are crucial components of the immune system, responsible for identifying and neutralizing pathogens like bacteria and viruses. In this context, 'Ab' could be an antibody targeting IL-6 or its receptor IL-6Rα.

2. **Role in Pathways**: IL-6 is a cytokine involved in various inflammatory and immune responses. The IL-6/IL-6Rα pathway is significant in inflammatory diseases. An antibody against IL-6 or IL-6Rα would play a role in modulating this pathway, potentially reducing inflammation by inhibiting the activity of IL-6.

3. **Interactions with Other Molecules**: The 'Ab' in the context likely interacts with IL-6 and its receptor IL-6Rα. This interaction is aimed at blocking the cytokine signaling pathway, thereby reducing inflammation and associated symptoms. The context suggests that targeting both IL-6 and the IL-6/IL-6Rα complex can lead to enhanced therapeutic efficacy.

4. **Importance in the Biological System**: In the biological model described, the antibody 'Ab' plays a critical therapeutic role. By targeting IL-6 and IL-6Rα, it helps manage conditions characterized by excessive inflammation, such as inflammatory bowel diseases, which aligns with the reference to changes in serum CRP (C-reactive protein) levels—a marker of inflammation response.

In summary, although specific details about the species 'Ab' are not provided, it is likely an antibody functioning within an inflammatory pathway, targeting IL-6 and its receptor to mitigate inflammatory responses in diseases such as inflammatory bowel disease."
mw5d764bb8_5693_4ac8_9557_f65992cc5eb0,Ab_sR,"The provided context does not include specific information about the species named 'Ab_sR' (ID: mw5d764bb8_5693_4ac8_9557_f65992cc5eb0). However, I can infer some possibilities based on general knowledge about similar biological components within the described context.

1. **Biological Function**: There is a mention of molecules like sIL-6R and IL-6Rα within the text. Typically, 'Ab' in 'Ab_sR' could refer to an antibody or related molecule. In biological systems, antibodies play a crucial role in the immune response by identifying and neutralizing foreign objects like bacteria and viruses.

2. **Role in Pathways**: If 'Ab_sR' is an antibody, it may be involved in regulatory or signaling pathways. The context discusses the IL-6 signaling pathway, which is important for immune response mediation. Antibodies can modulate such pathways by targeting cytokines or their receptors to either promote or inhibit responses.

3. **Interactions with Other Molecules**: The IL-6/sIL-6R complex is a subject of interest in the provided context, often interacting with other proteins like sgp130. Antibodies typically interact with antigens (specific target molecules), possibly modulating interactions between cytokines and their receptors or further downstream signaling molecules such as STAT3.

4. **Importance in the Biological System Being Modeled**: In the given context, antibodies targeting components of the IL-6 pathway are evaluated for their potential in therapy (like CRP suppression), indicating the importance of these molecules in modulating inflammatory responses. Antibodies can be crucial in therapeutically managing conditions involving dysregulated cytokine signaling.

Without specific information about 'Ab_sR', it is not possible to ascertain its precise function or interactions. However, based on the context involving IL-6 signaling and the mention of antibodies (likely abbreviation 'Ab'), 'Ab_sR' might be involved in similar biological processes."
mwedc1bc00_adf7_4144_a1c2_7dc1a9565dc2,Ab_sR_IL6,"The species ""Ab_sR_IL6"" appears to be involved in interactions with the soluble form of the interleukin-6 receptor (sIL-6Rα). Based on the context provided, and given the naming convention (Ab typically denotes an antibody), ""Ab_sR_IL6"" likely represents an antibody that targets the sIL-6Rα molecule. Although there is no explicit mention of ""Ab_sR_IL6"" in the documents, we can infer its role based on known biological interactions and the surrounding text.

### Inferred Background Information about Ab_sR_IL6:

1. **Biological Function**:
   - ""Ab_sR_IL6"" is likely an antibody designed to interact with the soluble form of the interleukin-6 receptor, sIL-6Rα. Antibodies targeting cytokine receptors are typically used to modulate signal transduction pathways and manage inflammatory responses.

2. **Role in Pathways**:
   - The potential pathway involvement of ""Ab_sR_IL6"" is connected to the IL-6 signaling pathway. By targeting sIL-6Rα, this antibody may influence the downstream signaling of IL-6, a cytokine involved in immune regulation and inflammatory processes.

3. **Interactions with Other Molecules**:
   - It is likely that ""Ab_sR_IL6"" interacts specifically with sIL-6Rα, preventing its interaction with IL-6. This action could block or reduce the IL-6/sIL-6Rα complex formation, thereby affecting the downstream activation of signal transducer and activator of transcription 3 (STAT3) and other related genes and proteins.

4. **Importance in the Biological System Being Modeled**:
   - The targeting of the IL-6/sIL-6Rα complex is significant in the context of diseases characterized by exaggerated IL-6 signaling, such as Crohn's disease and rheumatoid arthritis. Antibodies like ""Ab_sR_IL6"" play a crucial role in diminishing the inflammatory response, potentially leading to decreased C-reactive protein (CRP) levels and amelioration of disease symptoms.

In summary, while ""Ab_sR_IL6"" is not explicitly detailed in the provided documents, its inferred role as an antibody against sIL-6Rα suggests its importance as a therapeutic agent in managing IL-6 mediated pathways and inflammatory conditions."
mwbc2f5464_81e5_43fd_8b39_f5a2756af72f,Ab,"The provided documents include information that suggests 'Ab' refers to an antibody involved in targeting the interleukin-6 receptor (IL-6Rα) and its soluble form (sIL-6Rα). Here's a summary based on the context:

### Biological Function
- **Ab** appears to be an antibody that specifically targets the IL-6 receptor (both membrane-bound and soluble forms, IL-6Rα/sIL-6Rα).
- It plays a role in modulating the immune response by interfering with the IL-6 signaling pathway.

### Role in Pathways
- IL-6 is a cytokine involved in inflammatory and immune responses. The IL-6 receptor, which 'Ab' targets, is part of this pathway.
- Targeting both IL-6 and IL-6Rα/sIL-6Rα can enhance the suppression of CRP (C-reactive protein), a marker of inflammation, indicating that 'Ab' is involved in controlling inflammatory responses.

### Interactions with Other Molecules
- The context suggests that 'Ab' interacts with IL-6, IL-6Rα, and sIL-6Rα. By binding these molecules, the antibody can alter their function, essentially blocking the downstream signaling of the IL-6 pathway.

### Importance in the Biological System
- The use of this antibody ('Ab') represents a therapeutic strategy to dampen inflammatory responses, which could be important in treating inflammatory conditions or diseases such as inflammatory bowel diseases, as suggested by the context.
- The document discusses the antibody's dose-response effect on CRP suppression, highlighting its therapeutic potential in modifying disease progression or symptoms.

In summary, 'Ab' is an antibody participating in anti-inflammatory processes by targeting and inhibiting key components of the IL-6 signaling pathway. This interaction plays a significant role in reducing inflammation and is relevant in pharmacological interventions for diseases characterized by elevated IL-6 activity."
